Sheet: Requirements
A1: Id | B1: Level | C1: Traced From | D1: Requirement | E1: Note
A2: 0 | B2: 0 | D2: The System provide capability to store Data
A3: 1 | B3: 0 | D3: The System provide capability to trace Revision history
A4: 2 | B4: 0 | D4: The System provide capability for handling Read / Write Access
A5: 3 | B5: 0 | D5: The System provide capability for different Roles
A6: 4 | B6: 0 | D6: The System provide capability for handling different Projects
A7: 5 | B7: 0 | D7: The System provide capability for handling different File types
A8: 6 | B8: 0 | D8: The System provide capability for handling different Files
A9: 7 | B9: 0 | D9: The System provide capability for grouping related files
A10: 8 | B10: 0 | D10: The System provide capability add Meta data to a set of files (Item)
A11: 9 | B11: 0 | D11: The System provide capability add Meta data to an file (Item)
A12: 10 | B12: 0 | D12: The System shall Interface with users
A13: 11 | B13: 0 | D13: The System shall Interface with FreeCAD
A14: 12 | B14: 0 | D14: The System should be as secure as possible
A15: 13 | B15: 0 | D15: The System should also work without extra Resources(Hardware)
A16: 14 | B16: 1 | C16: of:=[.A$2] -> 0 | D16: The system provide capability get stored Data
A17: 15 | B17: 1 | C17: of:=[.A$2] -> 0 | D17: The system provide capability to compare stored Data with Local data
A18: 16 | B18: 1 | C18: of:=[.A$3] -> 1 | D18: The System shall provide capability to changes States
A19: 17 | B19: 1 | C19: 1 | D19: Every Item Shall have a Revision
A20: 18 | B20: 1 | C20: 1 | D20: Every Part Shall have a Revision
A21: 19 | B21: 1 | C21: 1 | D21: Every File Shall have a Revision
A22: 20 | B22: 1 | C22: of:=[.A$4] -> 2 | D22: The System shall provide capability to give write access on request
A23: 21 | B23: 1 | C23: of:=[.A$4] -> 2 | D23: The System shall provide capability to block request on Permissions
A24: 22 | B24: 1 | C24: of:=[.A$4] -> 2 | D24: The System shall provide capability to block request on States
A25: 23 | B25: 1 | C25: of:=[.A$4] -> 2 | D25: The System shall provide capability to block request on Activity
A26: 24 | B26: 1 | C26: of:=[.A$6] -> 4 | D26: The system provide capability to create New Projects
A27: 25 | B27: 1 | C27: of:=[.A$6] -> 4 | D27: The system provide capability to Remove Projects
A28: 26 | B28: 1 | C28: of:=[.A$6] -> 4 | D28: The system provide capability to Rename Projects
A29: 27 | B29: 1 | C29: of:=[.A$6] -> 4 | D29: The system provide capability to Modify Projects
A30: 28 | B30: 1 | C30: of:=[.A$8] -> 6 | D30: The system should provide capability to generate New files
A31: 29 | B31: 1 | C31: of:=[.A$8] -> 6 | D31: The system should provide capability to delete “New” files
A32: 30 | B32: 1 | C32: of:=[.A$8] -> 6 | D32: The system should provide capability to delete “Existing” files
A33: 31 | B33: 1 | C33: of:=[.A$8] -> 6 | D33: The system should provide capability to Rename Files
A34: 32 | B34: 1 | C34: of:=[.A$8] -> 6 | D34: The system should provide capability to Modify Files
A35: 33 | B35: 1 | C35: of:=[.A$10] -> 8 | D35: The system provide capability to generate “New” Items
A36: 34 | B36: 1 | C36: of:=[.A$10] -> 8 | D36: The system provide capability to Remove Items
A37: 35 | B37: 1 | C37: of:=[.A$10] -> 8 | D37: The system provide capability to Rename Items
A38: 36 | B38: 1 | C38: of:=[.A$10] -> 8 | D38: The system provide capability to Modify Items
A39: 37 | B39: 1 | C39: of:=[.A$12] -> 10 | D39: The system provide capability to give users Permissions
A40: 38 | B40: 1 | C40: of:=[.A$12] -> 10 | D40: The system provide capability to change users Permissions
A41: 39 | B41: 1 | C41: of:=[.A$13] -> 11 | D41: The User Should interact with the System via FreeCAD
A42: 40 | B42: 1 | C42: of:=[.A$13] -> 11 | D42: The System shall work with three FC Assembly Types
A43: 41 | B43: 1 | C43: of:=[.A$15] -> 13 | D43: The System should work on a RaspberryPi and bigger
A44: 42 | B44: 2 | C44: of:=[.A$18] -> 16 | D44: The System shall provide capability to lock items based on its State
A45: 43 | B45: 2 | C45: of:=[.A$19] -> 17 | D45: The System shall provide capability to lock files based on its State
A46: 44 | B46: 2 | C46: of:=[.A$20] -> 18 | D46: The System shall provide capability to lock items based on its Activity
A47: 45 | B47: 2 | C47: 21 | D47: The System shall provide capability to lock files based on its Activity
A48: 46 | B48: 2 | C48: of:=[.A$27] -> 25 | D48: Removing Project is only possible with Admin Rights
A49: 47 | B49: 2 | C49: of:=[.A$30] -> 28 | D49: The System provide capability to copy assemblies (that means with parts too)
A50: 48 | B50: 2 | C50: of:=[.A$32] -> 30 | D50: Removing Existing Files is only possible with Admin Rights
A51: 49 | B51: 2 | C51: of:=[.A$34] -> 32 | D51: Removing Items is only possible with Admin Rights
A52: 50 | B52: 2 | C52: of:=[.A$38] -> 36 | D52: The System provide capability to copy items
A53: 51 | B53: 2 | C53: of:=[.A41] -> 39 | D53: Upgrading FreeCAD interaction shall work via Add-on Manager
A54: 52 | B54: 2 | C54: of:=[.A42] -> 40 | D54: The system should recognize the used Assembly WB automatically
A55: 53
A56: 54
A57: 55
A58: 56
A59: 57
A60: 58
A61: 59
A62: 60
A63: 61
A64: 62
A65: 63
A66: 64
A67: 65
A68: 66
A69: 67
A70: 68
A71: 69
A72: 70
A73: 71
A74: 72
A75: 73
A76: 74
A77: 75
A78: 76
A79: 77
A80: 78
A81: 79
A82: 80
A83: 81
A84: 82
A85: 83
A86: 84
A87: 85
A88: 86
A89: 87
A90: 88
A91: 89
A92: 90
A93: 91
A94: 92
A95: 93
A96: 94
A97: 95
A98: 96
A99: 97
A100: 98
A101: 99
A102: 100

Sheet: Definitions
A1: Id | B1: Term | C1: Definition
A2: 0 | B2: Activity | C2: State as Result of User Action
A3: 1 | B3: State | C3: State of an object, document, File
A4: 2 | B4: System | C4: FreePDM
A5: 3 | B5: New | C5: (Creating) Object, Document, File that don’t exist yet
A6: 4 | B6: New | C6: (Modification) Object, Document, File that Never seen a Release State
A7: 5 | B7: Release | C7: State Where a Object, Part is allowed for production purposes
A8: 6 | B8: Project | C8: A (Sub)System where a group of objects, Parts, Assemblies belong to
A9: 7 | B9: Data
A10: 8 | B10: Interface | C10: Point where two or more System interact with each other
A11: 9 | B11: Item | C11: A group of objects, Files, Data, that are related
A12: 10 | B12: Resources | C12: (Hardware) Hardware like servers etc
A13: 11 | B13: Raspberry Pi | C13: Small type of hardware
A14: 12 | B14: Role | C14: A (set of )Functions a user can full-fill OR a (set of )Characteristic a user have
A15: 13 | B15: Admin | C15: A Role with high responsibility who have more rights than the other Roles
A16: 14
A17: 15
A18: 16
A19: 17
A20: 18
A21: 19

Sheet: Assumptions (Only if needed)
A1: Id | B1: Assumption | C1: Related too
A2: 0 | B2: No requirement about the hardware speed. Since this is dependent on the number of users. More users means more data through put and thus slower. | C2: #Requirements.A15
A3: 1 | B3: No requirement about the hardware storage. Since this is dependent on the Complexity of the tasks and probably number of users. | C3: #Requirements.A15
A4: 2
A5: 3
A6: 4
A7: 5
A8: 6
A9: 7
A10: 8
A11: 9
A12: 10
A13: 11
A14: 12
A15: 13
A16: 14
A17: 15
A18: 16
A19: 17
A20: 18
A21: 19
A22: 20